{
  "contract_name": "CodeProvenance",
  "contract_version": "1.0.0",
  "code_version": "8cca36056bde7cf55bf84bb699d59905994cb724",
  "source_tree_hash": "sha256:aa8902654fdec40134b862f9abff91330caadddcff7c8ac82bde494d4abff46a",
  "files": {
    "config/account-profile.unconfigured.v1.json": "sha256:755f4ca81f06881c51343d0dd7f48a5d5112124c6eca1ba1366e33033013d201",
    "contracts/p1a/AuditChainEvent.schema.json": "sha256:4ab95b95018e6a4613831c6fc0eb25df3bf05ca934a7858b6f55c2d392a54997",
    "contracts/p1a/CodeProvenance.schema.json": "sha256:8610a576717012d57ad2455254989b1a18e38fa8a2d5a1f508d941456b67caf8",
    "contracts/p1a/CostAttribution.schema.json": "sha256:387bd9f2eb1a9ccb8886c994abafbfd2bc582e9e74ad8f4acb04238120806d0e",
    "contracts/p1a/CostProfile.schema.json": "sha256:e9d70b944c284711fe19a04d01a3411c4a3e7e9db376f978f879fcd61e5bce5f",
    "contracts/p1a/DeterministicReplayResult.schema.json": "sha256:60ce29f0e2543c7a1e24fce284682aa533335a9b5f797690eceea15fdc05d539",
    "contracts/p1a/P1ACostEstimate.schema.json": "sha256:ae534c6a9abd2db063b9ad0f0074f4b2fd77adcb001d596383b208aab636687c",
    "contracts/p1a/PaperCalendarProjection.schema.json": "sha256:dd8b536a1fee9fe78d9c0d4e4ed4eae167656201c4cc3809af355ecf023ce850",
    "contracts/p1a/PaperReplayOrderIntent.schema.json": "sha256:ef590899177b81df4a73ed954f4b9dade87e35a7a0918d01ce526a9c76980797",
    "contracts/p1a/PaperSecurityProjection.schema.json": "sha256:2ebd31a4a7a528a44d11844872f9787f58d365a60738c53645599e46d830497a",
    "contracts/p1a/PathMetrics.schema.json": "sha256:f722328bfa72674668ef8f262f24ec0ca36ad885d4a8d90824327bc472087a1c",
    "contracts/p1a/ReplayInputManifest.schema.json": "sha256:b5d84f3767955b24235af59309b28b6c54cfcc3388ab21667651dca37f85ac13",
    "contracts/p1a/SnapshotLineageBundle.schema.json": "sha256:600ea6d57c3102c1ed4d5e3987fb904f9bbf60f1e297bb1b1824598e2cec28ef",
    "contracts/p1a/SourceObservation.schema.json": "sha256:94f793494be44b83a065c5f8894502d8916d3870fb05eac480be8b072c20ddbb",
    "contracts/reason-codes.p1a.json": "sha256:292a02a833d63917787bd70ab3a82f99e3f97e82dc061a6b086c787092a53101",
    "contracts/v1/AccountProfile.schema.json": "sha256:039296fae33ad694bd77c35c8c2774b2741f9cd0a03082dd6c83f1fa874ded1a",
    "contracts/v1/Approval.schema.json": "sha256:55ca29a826bbf29b5d074619edc8a9e6dae8c4bd63b5e26f6864fd2e031df56e",
    "contracts/v1/AuditEvent.schema.json": "sha256:2ae7f67344be7c1c6f45d83b7445d65120cd4c48bc03dfa54c509399fb38031d",
    "contracts/v1/BacktestResult.schema.json": "sha256:d1eb254faa802d28be328272dc323d03f67a0a6f807aaf2626f520f0cc887688",
    "contracts/v1/BrainPacket.schema.json": "sha256:f57359752088bc9788840f96711c7dfca4b598ff1d1ee88e07808ea93b3eedc0",
    "contracts/v1/CandidateEligibility.schema.json": "sha256:f0699554418579367d14d1ac16c40cc16fe033ac2fb76c9217dce850657e474a",
    "contracts/v1/CostEstimate.schema.json": "sha256:aca2e56876ecaa5a381f00e352c124ade1f416afbff7e37fb14511b6e3a3564b",
    "contracts/v1/DataEnvelope.schema.json": "sha256:45bb7495479ea41e4b796f91bb299c97ca03442a1c5228f28489addc90990760",
    "contracts/v1/FeatureSet.schema.json": "sha256:e3792a384b61d88cdce9c02fe119687a56c10f1207fefd24e9ac10dca7dc5831",
    "contracts/v1/Fill.schema.json": "sha256:803eefa1372ff7bba5f8ca6ada3cff61401cb7791a2cb85917e55554e07337b3",
    "contracts/v1/LedgerEntry.schema.json": "sha256:7dc318676c984f3ea45531651dccde5cfa4a8d71246edc84fec78ef95de8aeb5",
    "contracts/v1/OrderIntent.schema.json": "sha256:4e2c22852f5dda94cc06c66e6e50d5f5e39410960669546e4072d920beeee683",
    "contracts/v1/ResearchCard.schema.json": "sha256:efa9422bc5f79a7b81b9758df703a025dc9682297000648d37eb468bb0df56c5",
    "contracts/v1/SecurityIdentity.schema.json": "sha256:76d497ead91b8970009ee4f6abeb8b5273846e6c0db030b3736efcfad3aa4c15",
    "contracts/v1/SignalEvent.schema.json": "sha256:a5da23d5f59c8cf7a02ef1cfb4ffc243a04c0e4468006b61529f7ffada639470",
    "contracts/v1/SnapshotManifest.schema.json": "sha256:72e701091ca06095a564bc13151abd5e45d67eaa6482c6788748ddd277147e91",
    "contracts/v1/common.schema.json": "sha256:36605dc6b4090fc4d92f87cbafaf16ea0f5fb5756f0706c57be1ba5ff21f3de6",
    "migrations/001_schema_v1.sql": "sha256:ed626c0d79d1d1492e77e4c89d9324f62b6acd16753be19e6264dcfaf6bcff1a",
    "migrations/002_contract_registry.sql": "sha256:77e0e011e28ac6f8d8264d4263baed62cb6d6b7b3ea24a44292e4f43d4bf4f84",
    "migrations/003_p1a_data.sql": "sha256:5eb675742733eedba3ee3b3385517765e38c6bdb31d9f61bf873d7bc1b258340",
    "migrations/004_p1a_paper.sql": "sha256:d406ad7a493cb27503d9d4c460e3d5e10b1c589ee006c099dab391b1df253154",
    "migrations/005_p1a_replay_audit.sql": "sha256:e17bc7db16cc6f0177be12a3fa2de2dd8dd84b1d36ffc5510e71285e5dbb44ab",
    "package-lock.json": "sha256:af382898c678e6031f842830260226fcadc10dd7ff5efdf4bc814c84063c740d",
    "package.json": "sha256:51d78de9e21efc238864d95712709188f69f24e2578aee26ac82c2b044f19779",
    "scripts/check.mjs": "sha256:75494dc4f8fd8d49b1563e5d5517b5373397fae9afdd610a6b26a412dfed1457",
    "scripts/freeze-baseline.mjs": "sha256:11894b3216bbb2ecbc6664904336def61bacd44c4200549181deb2489670d29b",
    "scripts/freeze-p1a.mjs": "sha256:c0a053816aafff4f34240c3a4d791dcc6ba7f552f115f6161fb9d1397dbc7ada",
    "scripts/generate-contracts.mjs": "sha256:cd1927b13d01cd301001aa5f00fd37fa6ff3c2f0020d738f702912114b3ca524",
    "scripts/run-p1a-experiments.mjs": "sha256:1dc930e28c79f88e1020a096f9aabf8a98ba2312faed2253dc2d3346dfa2b732",
    "scripts/verify-contracts.mjs": "sha256:0aef878f10ce00c28393880056137717999275acc5ff781a1b8b1cff904e9060",
    "scripts/verify-p1a.mjs": "sha256:ad5dd5cf7cce87596273f6abc447f08d9d21b666b08758168e8b2fc3b0dddeb6",
    "src/baseline/economics.mjs": "sha256:028151e0dd73f654a1246c4aa4e55cca0454ef1a4e61717ef32c060d32cb0c86",
    "src/baseline/gates.mjs": "sha256:cfbcc3094d351f0a0572ca9ff7818469fcc30219b6b8c5f11e1d88de325985f4",
    "src/baseline/ledger.mjs": "sha256:51a05295e1c3a4d2db1916d01d47df9abf84c82c57eda46efa54736061e5ccd6",
    "src/baseline/migrate.mjs": "sha256:f448a734de132eceb8d0c921d904599d3ebb5f2dcd05a4fbc237648604fbd2cf",
    "src/baseline/staging.mjs": "sha256:b4446934cffb848c698c4819129d5a6bff99bd2dfe864820c116462aa7c59786",
    "src/contracts/validate.mjs": "sha256:db2c1325ead728ffb6aa82b03ef9e8daac8024bd39387f9ef864c3e36e5e3bd6",
    "src/cost/index.mjs": "sha256:e4aff2e77095acd92aa51c77791df6aa2aff4a98e6300b8b91c17fefe54f76f7",
    "src/data/calendar.mjs": "sha256:3e6b395ea6749951a4bfcb9881579e258f6c12bb18504249f0f4b7fdf8447e2b",
    "src/data/core.mjs": "sha256:a47832f684c22897a4e235cca9d70e4584d5bbc4f5a59690e2c4e0760414a4cc",
    "src/data/index.mjs": "sha256:9a631da2f21c79d2cbee24f5e7d873f4f4ff881465fd9d255509c4b91da5152f",
    "src/data/market.mjs": "sha256:3e9610442fc130bce7385de62e8528c035b04030641c11e3ef21e099afb34d39",
    "src/data/security.mjs": "sha256:95ba0eb465eafa8907d272900ba5c6ec3913173fdf4af8a10dbd865fa03c1485",
    "src/data/snapshot.mjs": "sha256:6d9360606082ad487de4dba8047589f4dc29aa945d2e39216b9e6630bb6378b8",
    "src/data/source.mjs": "sha256:d438fcca7d1ad0d552049383e619e328f2d5149c38edb4066371d72384c2c500",
    "src/p1a/audit.mjs": "sha256:14fdb1df51e7c8906694ffb6df20aea81fea8c4ae93d31a57bfede6226be91a1",
    "src/p1a/code-provenance.mjs": "sha256:62b4407dbc6f17ad038c3c89bdfcd81ea1b146665dbae1dbd0ca81b83d45bb9d",
    "src/p1a/contracts.mjs": "sha256:42619720b9a1ed59e2bb2a07ca21ed62cc83fb5155bf0f0aa763146efd5564a1",
    "src/p1a/core-skeleton.mjs": "sha256:c2702208e9e2c4a09721903b63828bf2f47f1a03791d2aec9e63015e1cb89d37",
    "src/p1a/edge.mjs": "sha256:5bedabc7f2c4aa222a1f85712b44a4156b831682a9f8a811c91af127276088b4",
    "src/p1a/fixture.mjs": "sha256:a61342bf5af0948d89c74a10f81dc74ee591fdb955409e2f759be71cedf4d935",
    "src/p1a/metrics.mjs": "sha256:960163da9f65e9dcea55e313033e813a8c186e399fd5e1f8c01441a5cdb56a5e",
    "src/p1a/replay.mjs": "sha256:216e19dc0ba69a550666f6f7e82bb155c36b5b11c5879330fd2b4f4cb63e5179",
    "src/p1a/unset-inventory.mjs": "sha256:91ae3c9ee596ed38f9744f3d123fa18e372f6cd395043a7ad9da3fa7dbf29f6a",
    "src/paper/index.mjs": "sha256:a83c7cd952f99258935730a649cd52c1a1ab277ce033eb7aec3d7b137f773331",
    "src/paper/oracle.mjs": "sha256:81fc3b13f06c7f51bbcb19dfa392214eb578c858a72d9daf9c88c99f9942f484",
    "tests/contracts.test.mjs": "sha256:738cf442acab94dccea52be9e045fa4e0694cd5f1a6e8d3ee3d0958513ecb796",
    "tests/economics.test.mjs": "sha256:cefe7ff1d61571124d129a5ab6bf17ba1f8b92ef4e73a508a5f4665745a207da",
    "tests/fixtures/p1a-data/helpers.mjs": "sha256:b60c5e6249e1b1d822317764c2484ccc458a6aa7361eed86eb9c2c7ee2ac3480",
    "tests/fixtures/p1a-replay/experiment.json": "sha256:5fa6cad97e1ea58f5484c7beabb3b862ce40a05e95a2c304b2871a4d0a2dd364",
    "tests/gates.test.mjs": "sha256:4df4d3e4c6b2d1f405234aa25d3dc66af41b3c1016605cfe05ac856cb075dcaa",
    "tests/helpers.mjs": "sha256:69ee1723f26822e054b1e39f8ffa515e3ef7b997945048d81aa910db27d9c717",
    "tests/ledger.test.mjs": "sha256:8037b247cf1db3e0b4321473739e3adf8ee5f749fe629ead676596929a8ce0d9",
    "tests/legacy.test.mjs": "sha256:efb9e51b64fdd78f049af5d8df0cf0b4b0725d318c15217c4a7b251bcb9a7987",
    "tests/p1a-cost.test.mjs": "sha256:5157a2174e66b65b76a445edbe2d07a08fc6a7ec6ee5c98d05334b7c8815bf4a",
    "tests/p1a-data.test.mjs": "sha256:53e6a63935962c065b3a14461c9a67e803b076711ed81a257afcaa3af70f35fe",
    "tests/p1a-integration-foundation.test.mjs": "sha256:704d95cb543fea8f6c724d88c04875ff2504a7f74d77fe7ff534f85613093469",
    "tests/p1a-integration-replay.test.mjs": "sha256:9cfae1a8ba705dfdec219ded08489aecaca4e95d43d85e2e2547a8bac924b3d9",
    "tests/p1a-paper-helpers.mjs": "sha256:f15ce62f293fe4070289f2c261ae0434f6dfcaf808801330006c5ba2a577e000",
    "tests/p1a-paper.test.mjs": "sha256:234f183b228915f101b83cbd0efecee4dc3c563765a754e0c5f364b2421ffa1d",
    "tests/p1a-production-lock.test.mjs": "sha256:e87edc48cdc9d4948e9af8419856c74c651606c9eed180ba0cccc4ded0c2e0c3",